headlines,id,author,created_utc,score,upvote_ratio,url,Topic 1,Topic 5,Topic 10,Topic 2,Topic 3,Topic 4,Topic 6,Topic 7,Topic 8,Topic 9
7AM; The Sun is rising on the 25th Day of the Russian Invasion on the Capital city of Kyiv. Ukraine continues to Live and Fight on.,tidnfn,AutoModerator,1647752413.0,3731,0.99,https://www.reddit.com/r/ukraine/comments/tidnfn/7am_the_sun_is_rising_on_the_25th_day_of_the/,0,0,0,0,0,0,0,0,0,0
"We were told we will get helmets and vests, but instead we were sent to ""look it up"" - Please help us in the Kyiv Territorial Defenses",tffeal,DinkaKay,1647429825.0,5157,0.96,https://www.reddit.com/r/ukraine/comments/tffeal/we_were_told_we_will_get_helmets_and_vests_but/,0,0,0,0,0,0,0,0,0,0
"Дергачі, Харківщина.",tijf1a,Evolxtra,1647777220.0,11708,0.98,https://i.redd.it/vnk0ryfx1jo81.jpg,0,0,0,0,0,0,0,0,0,0
"From Poland : ""We took out visitors from Ukraine for a shopping trip. The young one chose this as his toy, and suddenly everything made sense"".",til8to,MikeBruski,1647783469.0,3741,0.99,https://i.redd.it/pc5sf8bqkjo81.jpg,0,0,0,0,0,0,0,0,0,0
Azov raid in Mariupol combat footage,tigj88,byteseed,1647764888.0,13244,0.94,https://v.redd.it/eo4ilfog1io81,0,0,0,0,0,0,0,0,0,0
"President Zelenskyy: We do not have a huge territory - from ocean to ocean, we do not have nuclear weapons, we do not fill the world market with oil and gas. But we have our people and our land. For us it is gold.",tikqz7,american_psychoo,1647781909.0,3487,1.0,https://twitter.com/DefenceU/status/1505531321719865351?s=20&t=VTJ1BPVgmGcSVS_6WYwcIQ,0,0,0,0,0,0,0,0,0,0
New video from President Zelensky targeting english speaking audience,ting1v,swllord,1647789898.0,1930,0.99,https://v.redd.it/uwubw86u3ko81,0,0,0,0,0,0,0,0,0,0
Kadyrov captured an Ukrainian military vehicle… in front of the presidential palace of Chechnya.,tingkv,Evening_Repair323,1647789940.0,1842,0.98,https://www.reddit.com/gallery/tingkv,0,0,0,0,0,0,0,0,0,0
"Russia’s elite wants to eliminate Putin, they have already chosen a successor - intelligence",tij5bn,Passage-Extra,1647776152.0,3743,0.98,https://www.pravda.com.ua/eng/news/2022/03/20/7332985/,0,0,0,0,0,0,0,0,0,0
"28 years ago, on October 11, 1993, Ukraine launched a special operation to evacuate Georgian refugees from Abkhazia. Ukrainian pilots, using 17 helicopters, made 291 flights and saved 7643 lives, all while the war was still raging. While our current government forgot these heroes, people never did.",tih5vn,MisterTrollzor,1647767773.0,6107,0.99,https://i.redd.it/rjptdmod8io81.jpg,0,0,0,0,0,0,0,0,0,0
The bias and censorship in Russia at the moment,tiky8p,TawmanPlays,1647782548.0,2472,0.99,https://v.redd.it/3cse9ugxhjo81,0,0,0,0,0,0,0,0,0,0
"Something I've noticed over the past week or so here: almost every Ukrainian I spoke to has made it clear that they blame not only Putin, but the average Russian as much (or more) for this war. The view is: we overthrew our corrupt government, and they accept their murderous one.",tih831,xuxebiko,1647768039.0,4819,0.98,https://twitter.com/NeilPHauer/status/1505265888563453959?cxt=HHwWjoCzxbbW4-MpAAAA,0,0,0,0,0,0,0,0,0,0
Hope this is real,tilrxm,TemporaryReality5447,1647785062.0,1891,0.98,https://i.redd.it/ldv7uwtgpjo81.jpg,0,0,0,0,0,0,0,0,0,0
In Kherson people are literally blocking and forcing out the moving russian trucks. What a legends!,timxc6,theRockingRoller,1647788423.0,1516,1.0,https://v.redd.it/1j8vr4lfzjo81,0,0,0,0,0,0,0,0,0,0
"Poll: Ukrainians see Poland, Lithuania, the UK and the U.S. as their top allies. 98 percent of Ukrainians see Russia as their enemy.",tijzf8,CapitalString,1647779278.0,2429,0.99,https://www.reddit.com/r/ukraine/comments/tijzf8/poll_ukrainians_see_poland_lithuania_the_uk_and/,0,0,0,0,0,0,0,0,0,0
"Ukrainians defend not only their country, but the values of freedom, dignity, and expression.",tiivp3,FlamesToDust1992,1647775062.0,2960,0.93,https://i.redd.it/aiad8nfqvio81.jpg,0,0,0,0,0,0,0,0,0,0
In Energodar locals went to meeting with the demand to release the deputy mayor kidnapped by occupiers. Locals demand the immediate release of Ivan Samoidyuk and move away from the town,tilc14,anxiousgabriel,1647783745.0,1410,1.0,https://v.redd.it/o36253ailjo81,0,0,0,0,0,0,0,0,0,0
"In Energodar, unarmed people are ready to do anything to defend their land. They are not even frightened by gunfire",tim272,anxiousgabriel,1647785935.0,1268,1.0,https://v.redd.it/fr9vatp0sjo81,0,0,0,0,0,0,0,0,0,0
"""Stugna"" says hi to orcs",tigwpy,MiserableStructure,1647766652.0,3127,0.99,https://v.redd.it/4kqyd2co6io81,0,0,0,0,0,0,0,0,0,0
"Berdyansk, occupied by ruzzians",tikpgl,JD017,1647781764.0,1293,0.99,https://v.redd.it/xz35r4qnfjo81,0,0,0,0,0,0,0,0,0,0
"In Kherson, people went to a peaceful rally. Several thousand citizens have already gathered. They chant ""Home, while alive!"", ""Kherson is Ukraine!"".",tij499,anxiousgabriel,1647776036.0,1636,1.0,https://v.redd.it/vgbpbmzkyio81,0,0,0,0,0,0,0,0,0,0
"A man was detained in Moscow with a sign saying ""Crazy Putin is pushing the world into nuclear war""",timtja,beholdchris,1647788142.0,876,0.99,https://www.reddit.com/gallery/timtja,0,0,0,0,0,0,0,0,0,0
Chechen forces 'head home after losing hundreds of fighters in Ukraine invasion',timl6n,Souled_Out,1647787477.0,866,0.99,https://www.mirror.co.uk/news/world-news/chechen-forces-head-home-after-26511971,0,0,0,0,0,0,0,0,0,0
If you spread hate and framed informations in this subreddit against NATO or western allies you support russias goals and propaganda. Think twice.,tih8vt,Morgentau7,1647768133.0,2309,0.95,https://www.reddit.com/r/ukraine/comments/tih8vt/if_you_spread_hate_and_framed_informations_in/,0,0,0,0,0,0,0,0,0,0
"""We will win. There will be new cities. There will be new dreams. There will be a new story. There will be, there’s no doubt. And those we've lost will be remembered. And we will sing again, and we will celebrate anew."" - President Zelenskyy - March 20, 2022",tin21z,Eienkei,1647788785.0,744,0.99,https://v.redd.it/28z4fh7j0ko81,0,0,0,0,0,0,0,0,0,0
Ukraine's 🇺🇦 SOF/SSO showing an ambush on a Russian column by emplaced explosives along the road.,tihwpf,surajvj,1647770960.0,1924,0.99,https://v.redd.it/m1t2d8ehjio81,0,0,0,0,0,0,0,0,0,0
Motherhood in Ukraine 2022,tijbwg,ExactlySorta,1647776870.0,1318,0.99,https://i.redd.it/dfjae8z31jo81.jpg,0,0,0,0,0,0,0,0,0,0
Russia’s losses as of March 20,tiizgz,Tupreoram,1647775490.0,1390,0.99,https://i.redd.it/xy5skka0xio81.jpg,0,0,0,0,0,0,0,0,0,0
"After the loss of hundreds of fighters, the Kadyrovites returned from Ukraine to Chechnya",tidq4g,TheRealMykola,1647752694.0,4837,0.99,https://www.ukrinform.ua/rubric-ato/3434679-pisla-vtrati-soten-bijciv-kadirivci-z-ukraini-povernulisa-v-cecnu-radio-svoboda.html,0,0,0,0,0,0,0,0,0,0
"It maybe just a game of rugby in Paris but it's seen worldwide. Make no mistake MOST of the world supports Ukraine. I see more and more acts of solidarity and generosity here in Ireland and also from friends in Slovakia, Czech Republic. It's not much I know, but it is something.",tij5xa,TheGuvnor247,1647776216.0,1324,0.99,https://i.redd.it/33zhy82eyio81.jpg,0,0,0,0,0,0,0,0,0,0
"Video of ua forces on patrol, nsfw.",tihi6w,AllHailTheBEAR,1647769264.0,1854,0.99,https://v.redd.it/b5i30fkaeio81,0,0,0,0,0,0,0,0,0,0
This is how the Russian military only shoots at military targets. What is the fault of this child?,tihvyz,valeron_b,1647770865.0,1622,0.99,https://v.redd.it/18eg81jniio81,0,0,0,0,0,0,0,0,0,0
The equipment of the Russian fascists is going in the direction of their ship,tin6l5,anxiousgabriel,1647789146.0,637,1.0,https://v.redd.it/utn06d3l1ko81,0,0,0,0,0,0,0,0,0,0
The city of Budapest renamed the metro stop right in front of the Russian embassy. Budapest is run by the opposition to Viktor Orban.,til95y,dbdr,1647783496.0,816,1.0,https://www.reddit.com/gallery/til95y,0,0,0,0,0,0,0,0,0,0
"World Petition for ""Put Putin in war trial""",tijl6e,kEeEeEktyc,1647777824.0,1090,0.98,https://unacov.uk/petition-to-put-putin-on-trial/,0,0,0,0,0,0,0,0,0,0
Seattle Kraken game started with the Ukrainian anthem (pic by me),timr2l,WeArePandey,1647787946.0,617,0.99,https://i.redd.it/0dl65vk1yjo81.jpg,0,0,0,0,0,0,0,0,0,0
France Freezes 22 Billion Euros Of Assests Of The Russian Federation Central Bank,tilz6p,Key_Brother,1647785676.0,680,1.0,https://twitter.com/nexta_tv/status/1505525247692398592?t=L5W7IY6ln64pErpoPxwcHw&s=09,0,0,0,0,0,0,0,0,0,0
"While moving with provisions to the soldiers defending the city, the Azovs were stopped by citizens asking for help with food. Defenders of the city shared their modest reserves to feed at least a few children and the elderly. Mariupol, Ukraine",tiavzx,Bozzooo,1647742469.0,8033,0.96,https://v.redd.it/q4lik4rp6go81,0,0,0,0,0,0,0,0,0,0
"Immediate aftermath of a Russian attack on Kyiv today. If a single terrorist attack happened in any European city causing this much damage, there would be outrage for weeks. This is one of dozens happening every day in UA. Shout, pressure the politicians and companies! Never let this be normalized!",til447,-martinique-,1647783059.0,777,0.98,https://v.redd.it/bgskjomzijo81,0,0,0,0,0,0,0,0,0,0
I JUST HOPE THIS IS VERIFIED SOON.,tiosff,MARKO_GRAOVAK,1647793692.0,428,1.0,https://i.redd.it/l6osjhl4fko81.jpg,0,0,0,0,0,0,0,0,0,0
People in Sumy bomb shelter watching a stand-up performance. We are unbeatable. 💪,tin056,licht1nstein,1647788637.0,640,1.0,https://i.imgur.com/tfSTClp.jpg,0,0,0,0,0,0,0,0,0,0
Google: Chinese state hackers target Ukraine’s government,tik2y7,Profunwell,1647779641.0,839,0.98,https://www.bleepingcomputer.com/news/security/google-chinese-state-hackers-target-ukraine-s-government/#.YjcfAlOLnko.reddit,0,0,0,0,0,0,0,0,0,0
Turkey says Putin is no longer going to talk to Zelenskyy,tifp0g,TheRealMykola,1647761016.0,2097,0.99,https://www.pravda.com.ua/eng/news/2022/03/19/7332853/,0,0,0,0,0,0,0,0,0,0
Fallen Georgian warriors.,tikw5r,ironsteel9011,1647782370.0,691,0.99,https://www.reddit.com/gallery/tikw5r,0,0,0,0,0,0,0,0,0,0
A rare rhino was born in the Czech Safari Park Dvůr Králové. The baby was given the name Kyiv 🇺🇦,tindal,surajvj,1647789677.0,472,0.99,https://www.reddit.com/gallery/tindal,0,0,0,0,0,0,0,0,0,0
Protesters block Poland-Belarus highway to choke Russia's economy,tijllq,ImaginaryBet101,1647777865.0,850,1.0,https://www.trtworld.com/magazine/protesters-block-poland-belarus-highway-to-choke-russia-s-economy-55648,0,0,0,0,0,0,0,0,0,0
"List of wars Russia started that proves that people who say ""what about siria, afganistan, irak,..."" are uneducated and wrong. If you dont like wars in that country blame Russia - who played a bigger role in all of these wars (and more) than Nato and USA.",tiihw8,Typical-Travel-1356,1647773509.0,1013,0.93,https://www.reddit.com/r/ukraine/comments/tiihw8/list_of_wars_russia_started_that_proves_that/,0,0,0,0,0,0,0,0,0,0
Anti-Tank Cat to the rescue.,tipejb,offfmychest_25,1647795367.0,307,0.97,https://i.redd.it/alwimvx3kko81.jpg,0,0,0,0,0,0,0,0,0,0
I wanted to express my feelings for the Russian Genocide of the Ukrainian People in the best way I could. I am not the best artist but I have always wanted to visit Ukraine and will support your People with my whole soul.,tikao5,According-Anybody508,1647780393.0,641,0.91,https://i.redd.it/pdnvfngibjo81.jpg,0,0,0,0,0,0,0,0,0,0
it's been another tough week - here's a reason to smile: a Ukrainian refugee child being welcomed by his new kindergarten class in Spain,tiahk9,Artane_33,1647741159.0,5467,0.99,https://v.redd.it/w7nrmitv2go81,0,0,0,0,0,0,0,0,0,0
Russians may use images of mass graves of their victims in Mariupol and cities they capture as propaganda to 'prove' genocide. Be ready for a sudden spike in pro-Russia posts.,tigxba,lazyady,1647766727.0,1214,0.98,https://ichef.bbci.co.uk/live-experience/cps/624/cpsprodpb/vivo/live/images/2022/3/19/8563e9f1-293a-4626-9947-beb08fd4048a.png,0,0,0,0,0,0,0,0,0,0
"""I shoot at the armor. If they climb inside, it is their fault"" - Ukrainian Lt. Commander of anti-tank unit near Kyiv",ticwcc,harshvoldy,1647749573.0,2906,0.99,https://twitter.com/vicjkim/status/1505394345393864705,0,0,0,0,0,0,0,0,0,0
"Turkey could give Ukraine S-400 air defense launchers, earlier bought from Russia, U.S. suggests",tiiidb,Fitzi01,1647773563.0,825,0.99,https://www.ukrinform.net/rubric-polytics/3434676-turkey-could-give-ukraine-s400-air-defense-launchers-earlier-bought-from-russia-us-suggests.html,0,0,0,0,0,0,0,0,0,0
"President Zelenskyy's daily public address on Mar 19, 24th day of invasion with english subtitles",tihkyq,xuxebiko,1647769593.0,976,0.99,https://v.redd.it/br99s56dfio81,0,0,0,0,0,0,0,0,0,0
GRU special forces destroyed after a fight in Mariupol,tijger,DMG443,1647777370.0,624,0.99,https://www.youtube.com/watch?v=AhKs6n9hQiw,0,0,0,0,0,0,0,0,0,0
"Enemy stopped in almost all directions, pushed 70km back from Kyiv",ti9a9r,NORDLAN,1647737146.0,5390,0.99,https://www.ukrinform.net/rubric-ato/3434603-enemy-stopped-in-almost-all-directions-pushed-70km-back-from-kyiv.html,0,0,0,0,0,0,0,0,0,0
"Ukrainian officials said that 56 people in a nursing home were killed nine days ago when a Russian tank fired on the facility in eastern Ukraine. The incident is only now being reported, the authorities said, because fighting made it impossible to get to the location in a town called Kreminna.",tikhvu,Chonakz,1647781104.0,511,0.99,https://www.reddit.com/r/ukraine/comments/tikhvu/ukrainian_officials_said_that_56_people_in_a/,0,0,0,0,0,0,0,0,0,0
Russian authorities want to send minors to war in Ukraine - intelligence,timuya,VMK_1991,1647788253.0,352,0.98,https://www.ukrinform.net/rubric-ato/3434923-russian-authorities-want-to-send-minors-to-war-in-ukraine-intelligence.html,0,0,0,0,0,0,0,0,0,0
Russia’s elites scheme to overthrow Putin to restore economic ties with Western countries.,tijv70,Balt1c,1647778841.0,539,0.99,https://twitter.com/KyivIndependent/status/1505518177932955649,0,0,0,0,0,0,0,0,0,0
EU paid Russia $16 billion for fossil fuels since the start of Ukraine war,tifhyw,Sell_Asame,1647760088.0,1409,0.94,https://www.newsweek.com/eu-paid-russia-16bn-fossil-fuels-since-start-ukraine-war-1689448,0,0,0,0,0,0,0,0,0,0
"Russians are blocked at US border, Ukrainians are admitted",tidv49,JoaquimSilva,1647753222.0,1984,0.98,https://news.yahoo.com/russians-blocked-us-border-ukrainians-221951267.html,0,0,0,0,0,0,0,0,0,0
Russian Regiment Wiped Out,tin9t7,Key_Brother,1647789410.0,293,0.99,https://twitter.com/sentdefender/status/1505548919375339521?t=E_6Ah642FNrRcwvkj-6jXw&s=09,0,0,0,0,0,0,0,0,0,0
"Kuleba: When 🇷🇺 attacked Ukraine, a 🇺🇦 Ambassador asked a foreign minister of an influential EU country for help. They responded by smiling and answered, ""my dear, let's be honest, why should we help you if all will end in 48 hours at most and a new reality sets in"".",ti9xv3,TheRealMykola,1647739305.0,4000,0.96,https://english.nv.ua/nation/foreign-minister-dmytro-kuleba-no-matter-how-difficult-it-may-be-we-cannot-give-up-50225539.html,0,0,0,0,0,0,0,0,0,0
"Incessantly, for 25 years out of 30 years of its modern history, Russia has brought nothing but death. Now we have the chance to stop Russian war-machine forever. Help Ukraine! Help the world! #StopRussia #StandWithUkraine",tijxcb,MinisterOfTruth99,1647779060.0,488,0.98,https://twitter.com/Ukraine/status/1504924620524240897,0,0,0,0,0,0,0,0,0,0
Belarus rail workers have cut rail connections towards Ukraine.,tib64k,ShekelBanker,1647743434.0,3088,0.99,https://www.dw.com/en/ukraine-belarusian-rail-workers-reportedly-cut-connections-live-updates/a-61188441,0,0,0,0,0,0,0,0,0,0
"Florida Gun Owner of Kel Tech, Is Donating 500 9mm carbines to Ukraine. More US Gun Owners should follow.",tio21x,Garricidal747,1647791679.0,245,0.96,https://youtu.be/Ay_EQPQ-MUQ,0,0,0,0,0,0,0,0,0,0
A bonus from occupiers.,tiomlq,Dvorakovsky,1647793232.0,226,1.0,https://v.redd.it/ui5js5jqdko81,0,0,0,0,0,0,0,0,0,0
"More than 2,500 Russian bodies ‘sent to Belarus in dead of night’ as Kremlin hides true death toll",tio3ld,Soupjoe5,1647791794.0,244,1.0,https://www.telegraph.co.uk/global-health/terror-and-security/2500-russian-bodies-sent-belarus-dead-night/,0,0,0,0,0,0,0,0,0,0
"German Minister of Trade and Commerce announces Energy-Partnership with Qatar. Germany will receive LNG, Hydrogen and Qatar will get Technologies for their medical and renewable energy sector.",tikqp5,-Xav,1647781881.0,393,0.98,https://www.zeit.de/wirtschaft/2022-03/energiepolitik-robert-habeck-katar-reise,0,0,0,0,0,0,0,0,0,0
"Another day, another attempt to denazify Feldman Ecopark in Kharkiv. Obviously the llamas are the worst nazi scum of them all...",tipmtg,ZuzBla,1647795964.0,182,0.98,https://i.redd.it/fd452bgmlko81.jpg,0,0,0,0,0,0,0,0,0,0
kindle store labels all Ukrainian literature works as Russian,tim4fh,Pure_Performance7673,1647786118.0,308,0.97,https://www.reddit.com/r/ukraine/comments/tim4fh/kindle_store_labels_all_ukrainian_literature/,0,0,0,0,0,0,0,0,0,0
russian forces beating an Ukrainian peacefully protester in Berdyansk,tim0rh,anxiousgabriel,1647785813.0,309,0.99,https://v.redd.it/sidqghhbrjo81,0,0,0,0,0,0,0,0,0,0
Russian Army Airborne Troops Unit Destroyed,tijcix,HTwoN0,1647776936.0,472,0.99,https://twitter.com/Armia_fm/status/1505467284361564160?t=XNmjUlJsN8koJhrMYlY9jw&s=19,0,0,0,0,0,0,0,0,0,0
''The front line of defence is littered with the corpses of Russian soldiers'' - Zelenskyy,tifpb4,TheRealMykola,1647761049.0,1057,0.99,https://www.pravda.com.ua/eng/news/2022/03/20/7332908/,0,0,0,0,0,0,0,0,0,0
"Alpaca Valley, Kharkiv Ecopark.",tiokmo,Did-ko,1647793083.0,203,1.0,https://i.imgur.com/yP1Uxmy.jpg,0,0,0,0,0,0,0,0,0,0
Ukraine footage of actual combat use of the FGM-148 Javelin anti-tank missile system by the Ukrainian army.,ti1vz6,AllHailTheBEAR,1647715593.0,39003,0.92,https://v.redd.it/ik3pvf4uydo81,0,0,0,0,0,0,0,0,0,0
"Journalist Ilya Kosygin reports on serious losses of Russian troops: ""Do you understand the magnitude of this? In all the 30 years of the existence of SOBR in Vladimir there have been no personnel losses at all. And yesterday in one day they buried its entire leadership.""",tigyr7,xuxebiko,1647766876.0,766,0.99,https://twitter.com/nexta_tv/status/1505464139468226560?cxt=HHwWgIC-8ZLqveQpAAAA,0,0,0,0,0,0,0,0,0,0
"Vitali Klitschko recorded a video from the site of the fall of the fragments of a Russian rocket in Kyiv. At the moment, there are no deaths. 5 people were injured. Two of them were hospitalized. Medics and rescuers are on the scene",tilu45,anxiousgabriel,1647785241.0,290,1.0,https://v.redd.it/736dw6yxpjo81,0,0,0,0,0,0,0,0,0,0
I don't understand how Putin's neo-Nazi reasoning for the war is so widely accepted,tii1fr,synthead,1647771546.0,595,0.96,https://www.reddit.com/r/ukraine/comments/tii1fr/i_dont_understand_how_putins_neonazi_reasoning/,0,0,0,0,0,0,0,0,0,0
Ukraine's new agriculture division.,ti6f93,Prizrenski_vitez,1647728385.0,6049,0.99,https://i.redd.it/rl0pntpx0fo81.jpg,0,0,0,0,0,0,0,0,0,0
"Russia is carrying out genocide in Ukraine, deputy Prime Minister declares - Mirror Online",tikq0l,Dark_Ozma,1647781816.0,329,0.99,https://www.mirror.co.uk/news/politics/russia-carrying-out-genocide-ukraine-26511853,0,0,0,0,0,0,0,0,0,0
"Unconfirmed: Russian Deputy Commander of the Black Sea Fleet, Captain First Rank Andrey Nikolaevich Paliy has been eliminated by Ukraine.",ti5302,TheRealMykola,1647724563.0,7562,0.98,https://i.redd.it/bz74fnafpeo81.jpg,0,0,0,0,0,0,0,0,0,0
Pope says 'slaughters and atrocities' committed daily in Ukraine,tikw3f,scot816,1647782365.0,308,0.99,https://www.reuters.com/world/europe/pope-says-slaughters-atrocities-committed-daily-ukraine-2022-03-20/,0,0,0,0,0,0,0,0,0,0
[Official Ukrainian Foreign Legion Statement 3/15] UFL spokesperson Corporal Damien Magrou in an interview with Canadian CTV News: Don't join Ukrainian Foreign Legion to fight for Ukraine against Russia's invasion unless you're a non-active duty veteran who's already trained & have combat experience,tibf3m,FortuneFavorsTendies,1647744299.0,2185,0.99,https://v.redd.it/21616plxbgo81,0,0,0,0,0,0,0,0,0,0
"(Older News) France deployed their Elite Police Unit (GIGN) to protect its embassy in Kyiv, their services at Zelensky's disposal upon request says French Foreign Minister Jean-Yves Le Drian",tieqj1,TheRealMykola,1647756690.0,1133,0.99,https://english.alarabiya.net/News/world/2022/02/25/France-sends-elite-police-unit-to-protect-its-embassy-in-Ukraine-s-Kyiv,0,0,0,0,0,0,0,0,0,0
What should you do if you're hosting Ukrainian refugees (especially children) - A list made by me with the help of a Ukrainian Child Psychologist and Trauma responder,til6ha,DinkaKay,1647783260.0,284,0.98,https://www.reddit.com/r/ukraine/comments/til6ha/what_should_you_do_if_youre_hosting_ukrainian/,0,0,0,0,0,0,0,0,0,0
Putin agrees to face-to-face peace talks with Ukrainian president Zelensky,tin59l,Tetizeraz,1647789043.0,211,0.94,https://www.walesonline.co.uk/news/uk-news/vladimir-putin-agrees-face-face-23446047,0,0,0,0,0,0,0,0,0,0
Dutch to provide weekly money to Ukraine refugees & no need for work permit,tilq4d,new22003,1647784923.0,265,1.0,https://www.dutchnews.nl/news/2022/03/dutch-agree-financial-support-for-ukrainians-scrap-work-permits/,0,0,0,0,0,0,0,0,0,0
Terrorist propaganda channel RT brags about using thermobaric weapons against Mariupol,timk7r,EverlastingShill,1647787402.0,223,0.98,https://t.me/truexanewsua/34914,0,0,0,0,0,0,0,0,0,0
8 Russian soldiers killed by Ukrainian babushka who gave them poison pastries,ti4tex,JupiterQuirinus,1647723801.0,6677,0.97,https://youtu.be/FNQdPocFax8,0,0,0,0,0,0,0,0,0,0
“6-to-8 weeks more fighting will deadline the entire Russian Army military truck fleet.” Why? They are operating an entire logistics fleet with 0 thought/ability for maintenance. This from the logistics guru for the US army.,tid37n,kwimfr,1647750296.0,1460,0.99,https://twitter.com/trenttelenko/status/1505370275273183239?s=21,0,0,0,0,0,0,0,0,0,0
"Enemy shells nursing home in Kreminna, killing 56",tikqn9,Passage-Extra,1647781877.0,291,0.99,https://www.ukrinform.net/rubric-ato/3434931-enemy-shells-nursing-home-in-kreminna-killing-56.html,0,0,0,0,0,0,0,0,0,0
Latest video of Zelensky narrating what was and what will be. Slava Ukraini!,tin1k7,Lord_Meklar,1647788747.0,196,0.98,https://v.redd.it/0nfbhmie0ko81,0,0,0,0,0,0,0,0,0,0
All four largest foreign oilfield services companies announced the termination of investments in the Russian Federation,tikw22,-martinique-,1647782361.0,281,0.98,https://www.reddit.com/gallery/tikw22,0,0,0,0,0,0,0,0,0,0
Mariupol is in the Donbas Region that Putin said is independent and a Russian Ally. Why is Russia destroying their independent ally?,tin5bp,nevereatsourws,1647789047.0,180,0.96,https://www.reddit.com/r/ukraine/comments/tin5bp/mariupol_is_in_the_donbas_region_that_putin_said/,0,0,0,0,0,0,0,0,0,0
NSDC bans pro-Russian parties in Ukraine,tikhsy,Diadochiofalexandros,1647781096.0,268,1.0,https://www.ukrinform.net/rubric-polytics/3434673-nsdc-bans-prorussian-parties-in-ukraine.html,0,0,0,0,0,0,0,0,0,0
Russia has no control of Ukrainian airspace - UK Defense Intel,tifmtv,TheRealMykola,1647760720.0,739,0.99,https://www.ukrinform.net/rubric-ato/3434693-russia-has-no-full-superiority-in-ukrainian-airspace-uk-defense-intel.html,0,0,0,0,0,0,0,0,0,0
@TheStudyofWar now assesses that Ukraine has “defeated the initial Russian campaign in this war” and that Russia no longer has the forces to take Kyiv and other major cities to force a change of gov’t. ISW believes war will likely descend into “a bloody stalemate.”,tii6ek,Aiden007700,1647772158.0,410,0.98,https://i.redd.it/2smcruj3nio81.jpg,0,0,0,0,0,0,0,0,0,0
This video gives good points why Russia is seriously struggling,tii55k,laurisma,1647772010.0,412,0.98,https://www.reddit.com/r/ukraine/comments/tii55k/this_video_gives_good_points_why_russia_is/,0,0,0,0,0,0,0,0,0,0
"""Azov"" continues to destroy the Russian troops",tii61p,balraj545,1647772115.0,395,0.98,https://youtu.be/EGuWbE6jILM,0,0,0,0,0,0,0,0,0,0
